{
  "$schema": "../schemas/collision.schema.json",
  "venue": "cottage",
  "cells": [
    "A2",
    "B2",
    "F2",
    "A4",
    "F3",
    "F5"
  ],
  "space": "venue-local",
  "volumes": [
    {
      "shape": "box",
      "center": [
        0.0,
        0.21,
        0.0
      ],
      "half": [
        3.3857,
        0.21,
        2.7228
      ],
      "tag": "plinth"
    },
    {
      "shape": "box",
      "center": [
        -2.4489,
        1.7914,
        -2.6028
      ],
      "half": [
        0.8169,
        1.3714,
        0.15
      ],
      "tag": "wall"
    },
    {
      "shape": "box",
      "center": [
        1.5169,
        1.7914,
        -2.6028
      ],
      "half": [
        1.7489,
        1.3714,
        0.15
      ],
      "tag": "wall"
    },
    {
      "shape": "box",
      "center": [
        0.0,
        1.7914,
        2.6028
      ],
      "half": [
        3.2657,
        1.3714,
        0.15
      ],
      "tag": "wall"
    },
    {
      "shape": "box",
      "center": [
        -3.2657,
        1.7914,
        0.0
      ],
      "half": [
        0.15,
        1.3714,
        2.6028
      ],
      "tag": "wall"
    },
    {
      "shape": "box",
      "center": [
        3.2657,
        1.7914,
        0.0
      ],
      "half": [
        0.15,
        1.3714,
        2.6028
      ],
      "tag": "wall"
    },
    {
      "shape": "box",
      "center": [
        -0.932,
        0.105,
        -3.2228
      ],
      "half": [
        0.85,
        0.105,
        0.5
      ],
      "kind": "surface",
      "tag": "step"
    },
    {
      "shape": "box",
      "center": [
        -0.932,
        0.21,
        -2.9728
      ],
      "half": [
        0.85,
        0.21,
        0.25
      ],
      "kind": "surface",
      "tag": "step"
    }
  ]
}