{
  "$schema": "../schemas/collision.schema.json",
  "venue": "dovecote",
  "cells": [
    "J5",
    "J6",
    "K5",
    "K6"
  ],
  "space": "venue-local",
  "volumes": [
    {
      "shape": "box",
      "center": [
        -0.1188,
        3.1,
        2.4571
      ],
      "half": [
        0.378,
        3.1,
        0.26
      ],
      "rotY": 3.0933,
      "tag": "drum"
    },
    {
      "shape": "box",
      "center": [
        -0.7034,
        3.1,
        2.3572
      ],
      "half": [
        0.378,
        3.1,
        0.26
      ],
      "rotY": 2.8516,
      "tag": "drum"
    },
    {
      "shape": "box",
      "center": [
        -1.2471,
        3.1,
        2.1205
      ],
      "half": [
        0.378,
        3.1,
        0.26
      ],
      "rotY": 2.61,
      "tag": "drum"
    },
    {
      "shape": "box",
      "center": [
        -1.7183,
        3.1,
        1.7603
      ],
      "half": [
        0.378,
        3.1,
        0.26
      ],
      "rotY": 2.3683,
      "tag": "drum"
    },
    {
      "shape": "box",
      "center": [
        -2.0897,
        3.1,
        1.298
      ],
      "half": [
        0.378,
        3.1,
        0.26
      ],
      "rotY": 2.1267,
      "tag": "drum"
    },
    {
      "shape": "box",
      "center": [
        -2.3396,
        3.1,
        0.7602
      ],
      "half": [
        0.378,
        3.1,
        0.26
      ],
      "rotY": 1.885,
      "tag": "drum"
    },
    {
      "shape": "box",
      "center": [
        -2.4535,
        3.1,
        0.1782
      ],
      "half": [
        0.378,
        3.1,
        0.26
      ],
      "rotY": 1.6433,
      "tag": "drum"
    },
    {
      "shape": "box",
      "center": [
        -2.4249,
        3.1,
        -0.4141
      ],
      "half": [
        0.378,
        3.1,
        0.26
      ],
      "rotY": 1.4017,
      "tag": "drum"
    },
    {
      "shape": "box",
      "center": [
        -2.2553,
        3.1,
        -0.9825
      ],
      "half": [
        0.378,
        3.1,
        0.26
      ],
      "rotY": 1.16,
      "tag": "drum"
    },
    {
      "shape": "box",
      "center": [
        -1.9546,
        3.1,
        -1.4936
      ],
      "half": [
        0.378,
        3.1,
        0.26
      ],
      "rotY": 0.9184,
      "tag": "drum"
    },
    {
      "shape": "box",
      "center": [
        -1.5404,
        3.1,
        -1.918
      ],
      "half": [
        0.378,
        3.1,
        0.26
      ],
      "rotY": 0.6767,
      "tag": "drum"
    },
    {
      "shape": "box",
      "center": [
        -1.0366,
        3.1,
        -2.231
      ],
      "half": [
        0.378,
        3.1,
        0.26
      ],
      "rotY": 0.435,
      "tag": "drum"
    },
    {
      "shape": "box",
      "center": [
        -0.4727,
        3.1,
        -2.4142
      ],
      "half": [
        0.378,
        3.1,
        0.26
      ],
      "rotY": 0.1934,
      "tag": "drum"
    },
    {
      "shape": "box",
      "center": [
        0.1188,
        3.1,
        -2.4571
      ],
      "half": [
        0.378,
        3.1,
        0.26
      ],
      "rotY": -0.0483,
      "tag": "drum"
    },
    {
      "shape": "box",
      "center": [
        0.7034,
        3.1,
        -2.3572
      ],
      "half": [
        0.378,
        3.1,
        0.26
      ],
      "rotY": -0.2899,
      "tag": "drum"
    },
    {
      "shape": "box",
      "center": [
        1.2471,
        3.1,
        -2.1205
      ],
      "half": [
        0.378,
        3.1,
        0.26
      ],
      "rotY": -0.5316,
      "tag": "drum"
    },
    {
      "shape": "box",
      "center": [
        1.7183,
        3.1,
        -1.7603
      ],
      "half": [
        0.378,
        3.1,
        0.26
      ],
      "rotY": -0.7733,
      "tag": "drum"
    },
    {
      "shape": "box",
      "center": [
        2.0897,
        3.1,
        -1.298
      ],
      "half": [
        0.378,
        3.1,
        0.26
      ],
      "rotY": -1.0149,
      "tag": "drum"
    },
    {
      "shape": "box",
      "center": [
        2.3396,
        3.1,
        -0.7602
      ],
      "half": [
        0.378,
        3.1,
        0.26
      ],
      "rotY": -1.2566,
      "tag": "drum"
    },
    {
      "shape": "box",
      "center": [
        2.4535,
        3.1,
        -0.1782
      ],
      "half": [
        0.378,
        3.1,
        0.26
      ],
      "rotY": -1.4982,
      "tag": "drum"
    },
    {
      "shape": "box",
      "center": [
        2.4249,
        3.1,
        0.4141
      ],
      "half": [
        0.378,
        3.1,
        0.26
      ],
      "rotY": -1.7399,
      "tag": "drum"
    },
    {
      "shape": "box",
      "center": [
        2.2553,
        3.1,
        0.9825
      ],
      "half": [
        0.378,
        3.1,
        0.26
      ],
      "rotY": -1.9816,
      "tag": "drum"
    },
    {
      "shape": "box",
      "center": [
        1.9546,
        3.1,
        1.4936
      ],
      "half": [
        0.378,
        3.1,
        0.26
      ],
      "rotY": -2.2232,
      "tag": "drum"
    },
    {
      "shape": "box",
      "center": [
        1.5404,
        3.1,
        1.918
      ],
      "half": [
        0.378,
        3.1,
        0.26
      ],
      "rotY": -2.4649,
      "tag": "drum"
    },
    {
      "shape": "box",
      "center": [
        0.9147,
        0.14,
        2.8151
      ],
      "half": [
        0.83,
        0.14,
        0.31
      ],
      "kind": "surface",
      "tag": "doorstep",
      "rotY": -2.8274
    },
    {
      "shape": "cylinder",
      "center": [
        -0.0,
        3.1,
        0.0
      ],
      "radius": 0.16,
      "height": 5.6,
      "tag": "potence"
    }
  ]
}