{
  "$schema": "../schemas/collision.schema.json",
  "venue": "stalls",
  "cells": [
    "C3",
    "D3",
    "C4",
    "D4"
  ],
  "space": "venue-local",
  "volumes": [
    {
      "shape": "box",
      "center": [
        -4.3,
        1.05,
        -11.7
      ],
      "half": [
        1.375,
        1.05,
        0.975
      ],
      "rotY": -0.3316,
      "tag": "stall_produce"
    },
    {
      "shape": "box",
      "center": [
        3.95,
        1.05,
        -12.55
      ],
      "half": [
        1.225,
        1.05,
        0.925
      ],
      "rotY": 0.4363,
      "tag": "stall_fish"
    },
    {
      "shape": "box",
      "center": [
        -5.7,
        1.05,
        -8.25
      ],
      "half": [
        1.175,
        1.05,
        0.9
      ],
      "rotY": -0.192,
      "tag": "stall_bread"
    },
    {
      "shape": "box",
      "center": [
        5.35,
        1.05,
        -9.05
      ],
      "half": [
        1.275,
        1.05,
        0.875
      ],
      "rotY": 0.2618,
      "tag": "stall_cloth"
    },
    {
      "shape": "box",
      "center": [
        -6.85,
        1.05,
        -4.85
      ],
      "half": [
        1.15,
        1.05,
        0.925
      ],
      "rotY": -0.5236,
      "tag": "stall_herbs"
    },
    {
      "shape": "box",
      "center": [
        6.45,
        1.05,
        -5.3
      ],
      "half": [
        0.975,
        1.05,
        0.8
      ],
      "rotY": 0.576,
      "tag": "stall_charms"
    },
    {
      "shape": "box",
      "center": [
        -7.55,
        1.05,
        1.7
      ],
      "half": [
        1.3,
        1.05,
        0.95
      ],
      "rotY": -0.1396,
      "tag": "stall_pottery"
    },
    {
      "shape": "box",
      "center": [
        7.15,
        1.05,
        1.25
      ],
      "half": [
        1.25,
        1.05,
        1.0
      ],
      "rotY": 0.1047,
      "tag": "stall_roast"
    }
  ]
}