{
  "$schema": "../schemas/collision.schema.json",
  "venue": "shop_row",
  "cells": [
    "C5",
    "D5",
    "E5"
  ],
  "space": "venue-local",
  "volumes": [
    {
      "shape": "box",
      "center": [
        -6.5,
        0.175,
        0.0
      ],
      "half": [
        3.75,
        0.175,
        4.1
      ],
      "tag": "plinth"
    },
    {
      "shape": "box",
      "center": [
        -9.8225,
        3.325,
        -4.0
      ],
      "half": [
        0.3775,
        2.975,
        0.16
      ],
      "tag": "wall"
    },
    {
      "shape": "box",
      "center": [
        -5.3975,
        3.325,
        -4.0
      ],
      "half": [
        2.5975,
        2.975,
        0.16
      ],
      "tag": "wall"
    },
    {
      "shape": "box",
      "center": [
        -6.5,
        3.325,
        4.0
      ],
      "half": [
        3.7,
        2.975,
        0.16
      ],
      "tag": "wall"
    },
    {
      "shape": "box",
      "center": [
        -10.2,
        3.325,
        0.0
      ],
      "half": [
        0.16,
        2.975,
        4.0
      ],
      "tag": "wall"
    },
    {
      "shape": "box",
      "center": [
        -2.8,
        3.325,
        0.0
      ],
      "half": [
        0.16,
        2.975,
        4.0
      ],
      "tag": "wall"
    },
    {
      "shape": "box",
      "center": [
        0.3,
        0.175,
        0.0
      ],
      "half": [
        3.15,
        0.175,
        4.1
      ],
      "tag": "plinth"
    },
    {
      "shape": "box",
      "center": [
        -0.7445,
        3.5,
        -4.0
      ],
      "half": [
        2.0555,
        3.15,
        0.16
      ],
      "tag": "wall"
    },
    {
      "shape": "box",
      "center": [
        3.0805,
        3.5,
        -4.0
      ],
      "half": [
        0.3195,
        3.15,
        0.16
      ],
      "tag": "wall"
    },
    {
      "shape": "box",
      "center": [
        0.3,
        3.5,
        4.0
      ],
      "half": [
        3.1,
        3.15,
        0.16
      ],
      "tag": "wall"
    },
    {
      "shape": "box",
      "center": [
        -2.8,
        3.5,
        0.0
      ],
      "half": [
        0.16,
        3.15,
        4.0
      ],
      "tag": "wall"
    },
    {
      "shape": "box",
      "center": [
        3.4,
        3.5,
        0.0
      ],
      "half": [
        0.16,
        3.15,
        4.0
      ],
      "tag": "wall"
    },
    {
      "shape": "box",
      "center": [
        6.8,
        0.175,
        0.0
      ],
      "half": [
        3.45,
        0.175,
        4.1
      ],
      "tag": "plinth"
    },
    {
      "shape": "box",
      "center": [
        3.7175,
        3.2,
        -4.0
      ],
      "half": [
        0.3175,
        2.85,
        0.16
      ],
      "tag": "wall"
    },
    {
      "shape": "box",
      "center": [
        7.8425,
        3.2,
        -4.0
      ],
      "half": [
        2.3575,
        2.85,
        0.16
      ],
      "tag": "wall"
    },
    {
      "shape": "box",
      "center": [
        6.8,
        3.2,
        4.0
      ],
      "half": [
        3.4,
        2.85,
        0.16
      ],
      "tag": "wall"
    },
    {
      "shape": "box",
      "center": [
        3.4,
        3.2,
        0.0
      ],
      "half": [
        0.16,
        2.85,
        4.0
      ],
      "tag": "wall"
    },
    {
      "shape": "box",
      "center": [
        10.2,
        3.2,
        0.0
      ],
      "half": [
        0.16,
        2.85,
        4.0
      ],
      "tag": "wall"
    }
  ]
}