{
  "$schema": "../schemas/collision.schema.json",
  "venue": "bowyer",
  "cells": [
    "I10",
    "I9",
    "J10",
    "J9"
  ],
  "space": "venue-local",
  "volumes": [
    {
      "shape": "box",
      "center": [
        -0.7087,
        0.045,
        1.7963
      ],
      "half": [
        2.97,
        0.045,
        1.55
      ],
      "rotY": 0.434,
      "kind": "surface",
      "tag": "apron"
    },
    {
      "shape": "box",
      "center": [
        -0.5952,
        0.2,
        2.3975
      ],
      "half": [
        2.92,
        0.1,
        2.12
      ],
      "kind": "surface",
      "tag": "floor",
      "rotY": 0.384
    },
    {
      "shape": "box",
      "center": [
        0.1165,
        2.6,
        4.1592
      ],
      "half": [
        2.85,
        2.3,
        0.11
      ],
      "tag": "back_wall",
      "rotY": 0.384
    },
    {
      "shape": "box",
      "center": [
        -3.1913,
        2.6,
        3.4464
      ],
      "half": [
        0.11,
        2.3,
        2.0
      ],
      "tag": "side_wall",
      "rotY": 0.384
    },
    {
      "shape": "box",
      "center": [
        -3.9405,
        2.6,
        1.5921
      ],
      "half": [
        0.15,
        2.3,
        0.15
      ],
      "tag": "post",
      "rotY": 0.384
    },
    {
      "shape": "box",
      "center": [
        -1.3444,
        2.6,
        0.5432
      ],
      "half": [
        0.15,
        2.3,
        0.15
      ],
      "tag": "post",
      "rotY": 0.384
    },
    {
      "shape": "box",
      "center": [
        1.2517,
        2.6,
        -0.5057
      ],
      "half": [
        0.15,
        2.3,
        0.15
      ],
      "tag": "post",
      "rotY": 0.384
    },
    {
      "shape": "box",
      "center": [
        -1.1272,
        1.2,
        4.2842
      ],
      "half": [
        1.35,
        0.9,
        0.28
      ],
      "tag": "stave_rack",
      "rotY": 0.384
    },
    {
      "shape": "box",
      "center": [
        0.2632,
        1.42,
        0.9183
      ],
      "half": [
        0.34,
        1.12,
        0.4
      ],
      "rotY": 0.144,
      "tag": "tillering_frame"
    },
    {
      "shape": "box",
      "center": [
        -0.2145,
        0.73,
        2.4055
      ],
      "half": [
        0.98,
        0.43,
        0.32
      ],
      "tag": "bench",
      "rotY": 0.384
    },
    {
      "shape": "box",
      "center": [
        3.7307,
        1.12,
        2.1597
      ],
      "half": [
        1.55,
        1.02,
        0.8
      ],
      "rotY": 0.244,
      "tag": "butt"
    },
    {
      "shape": "cylinder",
      "center": [
        -4.9084,
        0.66,
        -1.7378
      ],
      "radius": 0.1,
      "height": 1.12,
      "tag": "hitching_post"
    }
  ]
}