{
  "$schema": "../schemas/collision.schema.json",
  "venue": "props_sheet",
  "cells": [],
  "space": "venue-local",
  "volumes": [
    {
      "shape": "box",
      "center": [
        0.0,
        0.04,
        0.0
      ],
      "half": [
        12.0,
        0.04,
        12.0
      ],
      "kind": "surface",
      "tag": "sheet"
    }
  ]
}