{
  "$schema": "../schemas/collision.schema.json",
  "venue": "quay",
  "cells": [
    "I3",
    "I4",
    "J3",
    "J4",
    "J2",
    "K3",
    "K4"
  ],
  "space": "venue-local",
  "volumes": [
    {
      "shape": "cylinder",
      "center": [
        70.4149,
        -1.1466,
        -58.574
      ],
      "radius": 0.24,
      "height": 0.82,
      "tag": "bollard"
    },
    {
      "shape": "cylinder",
      "center": [
        68.0172,
        -1.1466,
        -61.2593
      ],
      "radius": 0.24,
      "height": 0.82,
      "tag": "bollard"
    },
    {
      "shape": "cylinder",
      "center": [
        65.6195,
        -1.1466,
        -63.9446
      ],
      "radius": 0.24,
      "height": 0.82,
      "tag": "bollard"
    },
    {
      "shape": "cylinder",
      "center": [
        63.2218,
        -1.1466,
        -66.63
      ],
      "radius": 0.24,
      "height": 0.82,
      "tag": "bollard"
    },
    {
      "shape": "cylinder",
      "center": [
        60.824,
        -1.1466,
        -69.3153
      ],
      "radius": 0.24,
      "height": 0.82,
      "tag": "bollard"
    },
    {
      "shape": "cylinder",
      "center": [
        58.4263,
        -1.1466,
        -72.0006
      ],
      "radius": 0.24,
      "height": 0.82,
      "tag": "bollard"
    },
    {
      "shape": "cylinder",
      "center": [
        56.0286,
        -1.1466,
        -74.6859
      ],
      "radius": 0.24,
      "height": 0.82,
      "tag": "bollard"
    },
    {
      "shape": "box",
      "center": [
        69.1617,
        -3.0,
        -64.1815
      ],
      "half": [
        4.4,
        0.75,
        1.4
      ],
      "rotY": -0.8419,
      "tag": "boat"
    },
    {
      "shape": "box",
      "center": [
        62.7092,
        -3.0,
        -71.5581
      ],
      "half": [
        4.4,
        0.75,
        1.4
      ],
      "rotY": -0.8419,
      "tag": "boat"
    },
    {
      "shape": "cylinder",
      "center": [
        62.2433,
        1.0586,
        -61.4495
      ],
      "radius": 0.26,
      "height": 5.0,
      "tag": "crane_post"
    },
    {
      "shape": "cylinder",
      "center": [
        57.544,
        1.0586,
        -57.2535
      ],
      "radius": 0.26,
      "height": 5.0,
      "tag": "crane_post"
    },
    {
      "shape": "cylinder",
      "center": [
        66.4393,
        1.0586,
        -56.7502
      ],
      "radius": 0.26,
      "height": 5.0,
      "tag": "crane_post"
    },
    {
      "shape": "cylinder",
      "center": [
        61.74,
        1.0586,
        -52.5542
      ],
      "radius": 0.26,
      "height": 5.0,
      "tag": "crane_post"
    },
    {
      "shape": "box",
      "center": [
        58.5604,
        -0.8414,
        -53.9381
      ],
      "half": [
        1.5,
        0.7,
        1.0
      ],
      "rotY": -0.8419,
      "tag": "crane_counterweight"
    },
    {
      "shape": "hull",
      "points": [
        [
          42.0041,
          -65.9639
        ],
        [
          54.7,
          -77.3
        ],
        [
          72.04,
          -57.88
        ],
        [
          59.3441,
          -46.544
        ]
      ],
      "minY": -5.35,
      "maxY": -1.4416,
      "kind": "surface",
      "tag": "wharf_deck"
    },
    {
      "shape": "box",
      "center": [
        63.37,
        -3.8458,
        -67.59
      ],
      "half": [
        13.0174,
        2.1042,
        0.45
      ],
      "rotY": -0.8419,
      "tag": "quay_wall"
    },
    {
      "shape": "box",
      "center": [
        48.725,
        -3.8458,
        -71.965
      ],
      "half": [
        8.0102,
        2.1042,
        0.45
      ],
      "rotY": -2.4127,
      "tag": "quay_wall"
    },
    {
      "shape": "box",
      "center": [
        68.493,
        -3.8458,
        -54.713
      ],
      "half": [
        4.7551,
        2.1042,
        0.45
      ],
      "rotY": 0.7289,
      "tag": "quay_wall"
    },
    {
      "shape": "box",
      "center": [
        48.0,
        -1.2382,
        -44.0
      ],
      "half": [
        6.1033,
        0.2482,
        5.0992
      ],
      "rotY": -5.4978,
      "tag": "plinth"
    },
    {
      "shape": "box",
      "center": [
        41.2789,
        2.4231,
        -44.3489
      ],
      "half": [
        1.4975,
        3.4131,
        0.18
      ],
      "rotY": -5.4978,
      "tag": "wall.hm.slot.61.customs"
    },
    {
      "shape": "box",
      "center": [
        46.0542,
        2.4231,
        -49.1242
      ],
      "half": [
        3.7559,
        3.4131,
        0.18
      ],
      "rotY": -5.4978,
      "tag": "wall.hm.slot.61.customs"
    },
    {
      "shape": "box",
      "center": [
        51.535,
        2.4231,
        -40.465
      ],
      "half": [
        6.0033,
        3.4131,
        0.18
      ],
      "rotY": -5.4978,
      "tag": "wall.hm.slot.61.customs"
    },
    {
      "shape": "box",
      "center": [
        43.755,
        2.4231,
        -39.755
      ],
      "half": [
        0.18,
        3.4131,
        4.9992
      ],
      "rotY": -5.4978,
      "tag": "wall.hm.slot.61.customs"
    },
    {
      "shape": "box",
      "center": [
        52.245,
        2.4231,
        -48.245
      ],
      "half": [
        0.18,
        3.4131,
        4.9992
      ],
      "rotY": -5.4978,
      "tag": "wall.hm.slot.61.customs"
    },
    {
      "shape": "box",
      "center": [
        42.5852,
        -1.3622,
        -46.2209
      ],
      "half": [
        0.925,
        0.1241,
        0.34
      ],
      "rotY": -5.4978,
      "kind": "surface",
      "tag": "step"
    },
    {
      "shape": "box",
      "center": [
        42.7054,
        -1.2382,
        -46.1007
      ],
      "half": [
        0.925,
        0.2482,
        0.17
      ],
      "rotY": -5.4978,
      "kind": "surface",
      "tag": "step"
    },
    {
      "shape": "cylinder",
      "center": [
        40.715,
        2.01,
        -43.29
      ],
      "radius": 1.3,
      "height": 6.5,
      "tag": "stair_turret"
    },
    {
      "shape": "cylinder",
      "center": [
        41.1416,
        0.45,
        -49.8685
      ],
      "radius": 0.16,
      "height": 3.0,
      "tag": "weighbeam_post"
    },
    {
      "shape": "cylinder",
      "center": [
        43.2629,
        0.45,
        -47.7471
      ],
      "radius": 0.16,
      "height": 3.0,
      "tag": "weighbeam_post"
    },
    {
      "shape": "cylinder",
      "center": [
        44.3943,
        0.45,
        -53.1211
      ],
      "radius": 0.16,
      "height": 3.0,
      "tag": "weighbeam_post"
    },
    {
      "shape": "cylinder",
      "center": [
        46.5156,
        0.45,
        -50.9998
      ],
      "radius": 0.16,
      "height": 3.0,
      "tag": "weighbeam_post"
    }
  ]
}