{
  "$schema": "../schemas/collision.schema.json",
  "venue": "bakery",
  "cells": [
    "H8",
    "H9",
    "I8",
    "I9"
  ],
  "space": "venue-local",
  "volumes": [
    {
      "shape": "box",
      "center": [
        0.3742,
        0.18,
        -1.7607
      ],
      "half": [
        5.63,
        0.28,
        3.33
      ],
      "rotY": -0.2094,
      "kind": "surface",
      "tag": "plinth"
    },
    {
      "shape": "box",
      "center": [
        -3.6922,
        3.41,
        -5.8965
      ],
      "half": [
        0.6625,
        2.95,
        0.15
      ],
      "tag": "shop",
      "rotY": -0.2094
    },
    {
      "shape": "box",
      "center": [
        2.3967,
        3.41,
        -4.6023
      ],
      "half": [
        4.1125,
        2.95,
        0.15
      ],
      "tag": "shop",
      "rotY": -0.2094
    },
    {
      "shape": "box",
      "center": [
        -0.2911,
        3.41,
        1.3694
      ],
      "half": [
        5.5,
        2.95,
        0.15
      ],
      "tag": "shop",
      "rotY": -0.2094
    },
    {
      "shape": "box",
      "center": [
        -5.0056,
        3.41,
        -2.9042
      ],
      "half": [
        0.15,
        2.95,
        3.2
      ],
      "tag": "shop",
      "rotY": -0.2094
    },
    {
      "shape": "box",
      "center": [
        5.7541,
        3.41,
        -0.6172
      ],
      "half": [
        0.15,
        2.95,
        3.2
      ],
      "tag": "shop",
      "rotY": -0.2094
    },
    {
      "shape": "box",
      "center": [
        -2.2041,
        0.115,
        -6.2243
      ],
      "half": [
        0.725,
        0.115,
        0.5
      ],
      "kind": "surface",
      "tag": "step",
      "rotY": -0.2094
    },
    {
      "shape": "box",
      "center": [
        -2.256,
        0.23,
        -5.9797
      ],
      "half": [
        0.725,
        0.23,
        0.25
      ],
      "kind": "surface",
      "tag": "step",
      "rotY": -0.2094
    },
    {
      "shape": "box",
      "center": [
        0.6461,
        2.46,
        4.6561
      ],
      "half": [
        0.7,
        2.0,
        0.62
      ],
      "rotY": -0.2094,
      "tag": "flue"
    },
    {
      "shape": "box",
      "center": [
        1.274,
        2.01,
        1.7021
      ],
      "half": [
        2.8,
        1.55,
        0.21
      ],
      "tag": "ovenhouse",
      "rotY": -0.2094
    },
    {
      "shape": "box",
      "center": [
        0.5879,
        2.01,
        4.93
      ],
      "half": [
        2.8,
        1.55,
        0.21
      ],
      "tag": "ovenhouse",
      "rotY": -0.2094
    },
    {
      "shape": "box",
      "center": [
        -1.5688,
        2.01,
        1.609
      ],
      "half": [
        0.21,
        1.55,
        0.5
      ],
      "tag": "ovenhouse",
      "rotY": -0.2094
    },
    {
      "shape": "box",
      "center": [
        -2.047,
        2.01,
        3.8587
      ],
      "half": [
        0.21,
        1.55,
        0.5
      ],
      "tag": "ovenhouse",
      "rotY": -0.2094
    },
    {
      "shape": "box",
      "center": [
        3.6697,
        2.01,
        3.8982
      ],
      "half": [
        0.21,
        1.55,
        1.65
      ],
      "tag": "ovenhouse",
      "rotY": -0.2094
    },
    {
      "shape": "box",
      "center": [
        -2.4203,
        0.94,
        -0.1566
      ],
      "half": [
        0.9,
        0.48,
        0.42
      ],
      "rotY": -0.2094,
      "tag": "dough_trough"
    },
    {
      "shape": "box",
      "center": [
        3.9179,
        0.74,
        1.528
      ],
      "half": [
        0.6,
        0.28,
        0.42
      ],
      "rotY": -0.2094,
      "tag": "faggots"
    },
    {
      "shape": "box",
      "center": [
        2.6596,
        0.95,
        -5.0575
      ],
      "half": [
        1.8,
        0.49,
        0.44
      ],
      "rotY": -0.2094,
      "tag": "counter"
    },
    {
      "shape": "box",
      "center": [
        -0.2656,
        0.68,
        -6.4461
      ],
      "half": [
        0.95,
        0.22,
        0.2
      ],
      "rotY": -0.2094,
      "tag": "bench"
    },
    {
      "shape": "cylinder",
      "center": [
        -3.5027,
        0.98,
        -6.3674
      ],
      "radius": 0.4,
      "height": 1.05,
      "tag": "water_butt"
    }
  ]
}