{
  "$schema": "../schemas/collision.schema.json",
  "venue": "props_situ",
  "cells": [],
  "space": "venue-local",
  "volumes": [
    {
      "shape": "box",
      "center": [
        0.0,
        1.55,
        0.0
      ],
      "half": [
        4.4,
        1.55,
        0.17
      ],
      "tag": "back"
    },
    {
      "shape": "box",
      "center": [
        -4.4,
        1.55,
        -3.2
      ],
      "half": [
        3.2,
        1.55,
        0.17
      ],
      "rotY": 1.5708,
      "tag": "side-1"
    },
    {
      "shape": "box",
      "center": [
        4.4,
        1.413,
        -3.2
      ],
      "half": [
        3.2,
        1.55,
        0.17
      ],
      "rotY": 1.5708,
      "tag": "side1"
    },
    {
      "shape": "box",
      "center": [
        3.3,
        0.22,
        -2.4
      ],
      "half": [
        0.55,
        0.22,
        1.0
      ],
      "tag": "sledge"
    },
    {
      "shape": "cylinder",
      "center": [
        3.15,
        0.52,
        -0.66
      ],
      "radius": 0.42,
      "height": 1.05,
      "tag": "water_butt"
    },
    {
      "shape": "box",
      "center": [
        -2.64,
        0.52,
        -0.39
      ],
      "half": [
        1.496,
        0.52,
        0.23
      ],
      "tag": "woodpile"
    },
    {
      "shape": "cylinder",
      "center": [
        -3.55,
        0.23,
        -1.31
      ],
      "radius": 0.3,
      "height": 0.46,
      "tag": "chopping_block"
    },
    {
      "shape": "box",
      "center": [
        -4.05,
        1.42,
        -9.15
      ],
      "half": [
        0.1,
        1.2,
        0.1
      ],
      "tag": "shed_post"
    },
    {
      "shape": "box",
      "center": [
        -4.05,
        1.42,
        -6.35
      ],
      "half": [
        0.1,
        1.2,
        0.1
      ],
      "tag": "shed_post"
    },
    {
      "shape": "box",
      "center": [
        0.15,
        1.42,
        -9.15
      ],
      "half": [
        0.1,
        1.2,
        0.1
      ],
      "tag": "shed_post"
    },
    {
      "shape": "box",
      "center": [
        0.15,
        1.42,
        -6.35
      ],
      "half": [
        0.1,
        1.2,
        0.1
      ],
      "tag": "shed_post"
    },
    {
      "shape": "box",
      "center": [
        -1.95,
        0.65,
        -6.85
      ],
      "half": [
        1.2,
        0.43,
        0.31
      ],
      "tag": "workbench"
    }
  ]
}