{
  "$schema": "../schemas/collision.schema.json",
  "venue": "stables",
  "cells": [
    "E3",
    "E4",
    "F3",
    "F4"
  ],
  "space": "venue-local",
  "volumes": [
    {
      "shape": "box",
      "center": [
        -0.0,
        0.05,
        0.0
      ],
      "half": [
        8.4,
        0.05,
        6.4
      ],
      "kind": "surface",
      "tag": "yard",
      "rotY": -2.7925
    },
    {
      "shape": "box",
      "center": [
        -1.1629,
        0.22,
        -3.195
      ],
      "half": [
        7.67,
        0.12,
        2.72
      ],
      "kind": "surface",
      "tag": "stable_floor",
      "rotY": -2.7925
    },
    {
      "shape": "box",
      "center": [
        -2.0179,
        2.92,
        -5.5442
      ],
      "half": [
        7.6,
        2.58,
        0.11
      ],
      "tag": "back_wall",
      "rotY": -2.7925
    },
    {
      "shape": "box",
      "center": [
        5.9318,
        2.92,
        -5.7772
      ],
      "half": [
        0.11,
        2.58,
        2.6
      ],
      "tag": "side_wall",
      "rotY": -2.7925
    },
    {
      "shape": "box",
      "center": [
        -8.2575,
        2.92,
        -0.6127
      ],
      "half": [
        0.11,
        2.58,
        2.6
      ],
      "tag": "side_wall",
      "rotY": -2.7925
    },
    {
      "shape": "box",
      "center": [
        6.8211,
        2.92,
        -3.334
      ],
      "half": [
        0.16,
        2.58,
        0.16
      ],
      "tag": "post",
      "rotY": -2.7925
    },
    {
      "shape": "box",
      "center": [
        4.4561,
        2.92,
        -2.4732
      ],
      "half": [
        0.16,
        2.58,
        0.16
      ],
      "tag": "post",
      "rotY": -2.7925
    },
    {
      "shape": "box",
      "center": [
        2.0913,
        2.92,
        -1.6125
      ],
      "half": [
        0.16,
        2.58,
        0.16
      ],
      "tag": "post",
      "rotY": -2.7925
    },
    {
      "shape": "box",
      "center": [
        -0.2736,
        2.92,
        -0.7518
      ],
      "half": [
        0.16,
        2.58,
        0.16
      ],
      "tag": "post",
      "rotY": -2.7925
    },
    {
      "shape": "box",
      "center": [
        -2.6385,
        2.92,
        0.109
      ],
      "half": [
        0.16,
        2.58,
        0.16
      ],
      "tag": "post",
      "rotY": -2.7925
    },
    {
      "shape": "box",
      "center": [
        -5.0034,
        2.92,
        0.9697
      ],
      "half": [
        0.16,
        2.58,
        0.16
      ],
      "tag": "post",
      "rotY": -2.7925
    },
    {
      "shape": "box",
      "center": [
        -7.3683,
        2.92,
        1.8305
      ],
      "half": [
        0.16,
        2.58,
        0.16
      ],
      "tag": "post",
      "rotY": -2.7925
    },
    {
      "shape": "box",
      "center": [
        5.5516,
        1.12,
        -5.7985
      ],
      "half": [
        0.12,
        0.78,
        2.07
      ],
      "tag": "division",
      "rotY": -2.7925
    },
    {
      "shape": "box",
      "center": [
        4.3215,
        1.12,
        -5.3507
      ],
      "half": [
        0.12,
        0.78,
        2.07
      ],
      "tag": "division",
      "rotY": -2.7925
    },
    {
      "shape": "box",
      "center": [
        3.0913,
        1.12,
        -4.903
      ],
      "half": [
        0.12,
        0.78,
        2.07
      ],
      "tag": "division",
      "rotY": -2.7925
    },
    {
      "shape": "box",
      "center": [
        1.8612,
        1.12,
        -4.4552
      ],
      "half": [
        0.12,
        0.78,
        2.07
      ],
      "tag": "division",
      "rotY": -2.7925
    },
    {
      "shape": "box",
      "center": [
        0.631,
        1.12,
        -4.0075
      ],
      "half": [
        0.12,
        0.78,
        2.07
      ],
      "tag": "division",
      "rotY": -2.7925
    },
    {
      "shape": "box",
      "center": [
        -0.5991,
        1.12,
        -3.5598
      ],
      "half": [
        0.12,
        0.78,
        2.07
      ],
      "tag": "division",
      "rotY": -2.7925
    },
    {
      "shape": "box",
      "center": [
        -1.8292,
        1.12,
        -3.1121
      ],
      "half": [
        0.12,
        0.78,
        2.07
      ],
      "tag": "division",
      "rotY": -2.7925
    },
    {
      "shape": "box",
      "center": [
        -3.0594,
        1.12,
        -2.6643
      ],
      "half": [
        0.12,
        0.78,
        2.07
      ],
      "tag": "division",
      "rotY": -2.7925
    },
    {
      "shape": "box",
      "center": [
        -4.2895,
        1.12,
        -2.2166
      ],
      "half": [
        0.12,
        0.78,
        2.07
      ],
      "tag": "division",
      "rotY": -2.7925
    },
    {
      "shape": "box",
      "center": [
        -5.5197,
        1.12,
        -1.7688
      ],
      "half": [
        0.12,
        0.78,
        2.07
      ],
      "tag": "division",
      "rotY": -2.7925
    },
    {
      "shape": "box",
      "center": [
        -6.7498,
        1.12,
        -1.3211
      ],
      "half": [
        0.12,
        0.78,
        2.07
      ],
      "tag": "division",
      "rotY": -2.7925
    },
    {
      "shape": "box",
      "center": [
        -7.98,
        1.12,
        -0.8734
      ],
      "half": [
        0.12,
        0.78,
        2.07
      ],
      "tag": "division",
      "rotY": -2.7925
    },
    {
      "shape": "box",
      "center": [
        -1.9085,
        0.89,
        -5.2435
      ],
      "half": [
        7.2,
        0.55,
        0.3
      ],
      "tag": "mangers",
      "rotY": -2.7925
    },
    {
      "shape": "cylinder",
      "center": [
        -5.5696,
        0.42,
        2.8253
      ],
      "radius": 0.42,
      "height": 0.64,
      "tag": "shoeing_stand"
    },
    {
      "shape": "box",
      "center": [
        7.6728,
        0.42,
        2.3686
      ],
      "half": [
        0.55,
        0.32,
        0.42
      ],
      "rotY": -3.0925,
      "kind": "surface",
      "tag": "mounting_block"
    },
    {
      "shape": "box",
      "center": [
        5.8961,
        0.39,
        3.3345
      ],
      "half": [
        1.08,
        0.29,
        0.36
      ],
      "tag": "trough",
      "rotY": -2.7925
    },
    {
      "shape": "cylinder",
      "center": [
        -1.3993,
        0.62,
        6.0963
      ],
      "radius": 0.09,
      "height": 1.05,
      "tag": "rail_post"
    },
    {
      "shape": "cylinder",
      "center": [
        -4.4064,
        0.62,
        7.1907
      ],
      "radius": 0.09,
      "height": 1.05,
      "tag": "rail_post"
    },
    {
      "shape": "cylinder",
      "center": [
        -7.2712,
        0.59,
        -2.1423
      ],
      "radius": 1.45,
      "height": 0.98,
      "tag": "muck_heap"
    }
  ]
}