{
  "$schema": "../schemas/collision.schema.json",
  "venue": "confectioner",
  "cells": [
    "H7",
    "H8"
  ],
  "space": "venue-local",
  "volumes": [
    {
      "shape": "box",
      "center": [
        0.0,
        0.17,
        0.0
      ],
      "half": [
        3.12,
        0.27,
        5.12
      ],
      "kind": "surface",
      "tag": "plinth"
    },
    {
      "shape": "box",
      "center": [
        -0.99,
        3.29,
        -5.0
      ],
      "half": [
        2.01,
        2.85,
        0.15
      ],
      "tag": "shop"
    },
    {
      "shape": "box",
      "center": [
        2.71,
        3.29,
        -5.0
      ],
      "half": [
        0.29,
        2.85,
        0.15
      ],
      "tag": "shop"
    },
    {
      "shape": "box",
      "center": [
        0.0,
        3.29,
        5.0
      ],
      "half": [
        3.0,
        2.85,
        0.15
      ],
      "tag": "shop"
    },
    {
      "shape": "box",
      "center": [
        -3.0,
        3.29,
        0.0
      ],
      "half": [
        0.15,
        2.85,
        5.0
      ],
      "tag": "shop"
    },
    {
      "shape": "box",
      "center": [
        3.0,
        3.29,
        0.0
      ],
      "half": [
        0.15,
        2.85,
        5.0
      ],
      "tag": "shop"
    },
    {
      "shape": "box",
      "center": [
        1.72,
        0.11,
        -5.6
      ],
      "half": [
        0.675,
        0.11,
        0.48
      ],
      "kind": "surface",
      "tag": "step"
    },
    {
      "shape": "box",
      "center": [
        1.72,
        0.22,
        -5.36
      ],
      "half": [
        0.675,
        0.22,
        0.24
      ],
      "kind": "surface",
      "tag": "step"
    },
    {
      "shape": "box",
      "center": [
        -1.05,
        0.92,
        -5.48
      ],
      "half": [
        1.175,
        0.48,
        0.42
      ],
      "tag": "counter"
    }
  ]
}